Date,Publisher,Title,Authors,URL,Content
2022-10-05,CNN,White House says Biden’s Saudi trip wasn’t a waste as he lambastes OPEC+’s ‘shortsighted’ decision to cut oil output,Kevin Liptak,https://www.cnn.com/2022/10/05/politics/biden-opec-oil/index.html," President Joe Biden is “disappointed” the Saudi-led OPEC+ oil cartel agreed to cut output by 2 million barrels per day, the White House said Wednesday, as the threat of rising gas prices looms weeks ahead of critical midterm elections. The decision by the grouping of major oil producers rebuffed heavy lobbying from US administration officials and prompted Biden to say he was concerned about the move. It reversed a small increase in output OPEC+ announced shortly after Biden visited Saudi Arabia for a conference in July. Still, the White House insisted that visit was not a “waste of time,” even as it sharply criticized the decision to cut production. “The President is disappointed by the shortsighted decision by OPEC+ to cut production quotas while the global economy is dealing with the continued negative impact of Putin’s invasion of Ukraine,” said two of Biden’s top aides, national security adviser Jake Sullivan and National Economic Council Director Brian Deese, in a statement. “At a time when maintaining a global supply of energy is of paramount importance, this decision will have the most negative impact on lower- and middle-income countries that are already reeling from elevated energy prices,” the two advisers wrote. The administration will “consult with Congress on additional tools and authorities to reduce OPEC’s control over energy prices,” the statement read, without specifying which actions are under consideration dampen the oil cartel’s sway. Slashing oil production just ahead of November’s midterm elections poses a potential political problem for the President, who has touted this summer’s decreasing gas prices as he works to promote his agenda. The average gas price has been rising nationally again in recent days, according to AAA. Earlier this year, Biden announced a major release of barrels from the Strategic Petroleum Reserve in an effort to alleviate pump prices. On Tuesday, the White House said it was not considering additional releases beyond the 180 million previously announced. But after OPEC+ announced its decision on Wednesday, the White House said Biden would “continue to direct SPR releases as necessary,” apparently cracking open the door again to potential releases. Departing the White House on Wednesday, Biden said he was concerned about the possibility of a significant cut to production. “I need to see what the detail is. I am concerned, it is unnecessary,” he said in response to a question about the OPEC+ decision as he departed the White House for Florida, where he was set to tour storm damage. The international cartel of oil producers held a critical meeting Wednesday, where energy ministers decided to slash production by 2 million barrels per day, the biggest cut since the start of the pandemic. For the past several days, Biden’s senior-most energy, economic and foreign policy officials had been lobbying their foreign counterparts in Middle Eastern allied countries including Kuwait, Saudi Arabia and the United Arab Emirates to vote against cutting oil production. When he visited Saudi Arabia in July, Biden sought to make clear it wasn’t solely to ask the oil-rich kingdom to increase its oil output. After decrying the regime’s human rights record as a candidate, Biden fist-bumped the powerful Crown Prince Mohammed bin Salman, who US intelligence has said masterminded the murder of Saudi journalist and US resident Jamal Khashoggi. Speaking on Fox News shortly after the decision was announced, National Security Council communications coordinator John Kirby said the oil cartel was “adjusting back their numbers down a little bit” after making a small increase after Biden’s visit. “OPEC+ has been saying and telling the word they’re actually producing 3.5 million more barrels than they actually are. So in some ways this announced decrease really gets them back into more align with actual production,” Kirby said, noting there hadn’t yet been dramatic shifts in the price of oil. “We have to see how it plays out over the long term,” he said. Kirby said Biden’s visit to Jeddah, Saudi Arabia, for a regional conference “was not about oil.” “It was about larger national strategic and national interest goals throughout the region to try to foster more integrated cooperative region,” he said."
2022-10-05,CNN,OPEC announces the biggest cut to oil production since the start of the pandemic,Hanna Ziady,https://www.cnn.com/2022/10/05/energy/opec-production-cuts/index.html," OPEC+ said Wednesday that it will slash oil production by 2 million barrels per day, the biggest cut since the start of the pandemic, in a move that threatens to push gasoline prices higher just weeks before US midterm elections. The group of major oil producers, which includes Saudi Arabia and Russia, announced the production cut following its first meeting in person since March 2020. The reduction is equivalent to about 2% of global oil demand. The price of Brent crude oil rose 1.5% to more than $93 a barrel on the news, adding to gains this week ahead of the gathering of oil ministers. US oil was up 1.7% at $88. The Biden administration criticized the OPEC+ decision in a statement on Wednesday, calling it “shortsighted” and saying that it will hurt low and middle-income countries already struggling with elevated energy prices the most. The production cuts will start in November, and the Organization of Petroleum Exporting Countries (OPEC) and its allies will meet again in December. In a statement, the group said the decision to cut production was made “in light of the uncertainty that surrounds the global economic and oil market outlooks.” Global oil prices, which soared in the first half of the year, have since dropped sharply on fears that a global recession will depress demand. Brent crude is down 20% since the end of June. The global benchmark hit a peak of $139 a barrel in March after Russia’s invasion of Ukraine. OPEC and its allies, which control more than 40% of global oil production, are hoping to preempt a drop in demand for their barrels from a sharp economic slowdown in China, the United States and Europe. Western sanctions on Russian oil are also muddying the waters. Russia’s production has held up better than predicted, with supply being diverted to China and India. But the United States and Europe are now working on ways to implement a G7 agreement to cap the price of Russian crude exports to third countries. The oil cartel came under intense pressure from the White House ahead of its meeting in Vienna as President Biden tried to secure lower energy prices for US consumers. Senior Biden administration officials were lobbying their counterparts in Kuwait, Saudi Arabia, and the United Arab Emirates (UAE) to vote against cutting oil production, according to officials. The prospect of a production cut was framed as a “total disaster” in draft talking points circulated by the White House to the Treasury Department on Monday, which CNN obtained. “It’s important everyone is aware of just how high the stakes are,” one US official said. With just a month to go before the critical midterm elections, US gasoline prices have begun to creep up again, posing a political risk the White House is desperately trying to avoid. Rising oil prices could mean inflation remains higher for longer, and add to pressure on the Federal Reserve to hike interest rates even more aggressively. But the impact of Wednesday’s cut, while a bullish signal for oil prices, may be limited as many smaller OPEC producers were struggling to meet previous production targets. “An announced cut of any volume is unlikely to be fully implemented by all countries, as the group already lags 3 million barrels per day behind its stated production ceiling,” Rystad Energy analyst Jorge Leon said in a note. Rystad Energy estimates that the global oil market will be oversupplied between now and the end of the year,   dampening the effect of production cuts on prices. — Alex Marquardt, Natasha Bertrand, Phil Mattingly, Mark Thompson and Betsy Klein contributed to this report."
2022-10-05,CNN,"Latino representation in media industry grew by only 1% in the past decade, a new report finds",Jalen Brown,https://www.cnn.com/2022/10/05/us/latino-media-underrepresentation-goa-report-reaj/index.html," Latinos remain grossly underrepresented in the media industry and are significantly more likely to perform service roles, according to the Government Accountability Office’s (GAO) newest report on Latino representation in film, television, and other publishing entities. The GAO’s 2021 study found that Latinos make up 12% of the media workforce and 4% of industry management, despite making up 18% of the overall U.S. workforce. This latest report, released on Wednesday, provides a more comprehensive data analysis of Latino representation in the media industry over the last decade and solutions federal agencies could take to help increase diversity in the industry. The population of Latinos in the media industry increased by 1% from 2010 to 2019, compared to the slightly larger 3% rise in representation across all other sectors, according to the report. “This invisibility means that Americans don’t know who Latinos are or how we have contributed to the success of our nation. This year’s report will be a call-to-action to achieve greater Latino representation in media and enable the Latino narrative to finally be part of the larger American narrative, ” said Rep. Joaquin Castro, a Texas Democrat, who led an effort in Congress to investigate the state of diversity in media. The findings released on Wednesday are part of the second installment of the GAO report. Last year, the agency released its first report, in which researchers analyzed Hispanic representation by media industry and by occupation. The Congressional Hispanic Caucus had asked the GAO to investigate the issue in 2020. The initial report, Castro said in a statement, “put a national spotlight on the industry’s failure to recruit and retain talented Latinos.” The media industry is responsible for informing the American public and influencing the way we think about the world and other people, which is why it’s essential for society to represent those diverse perspectives from top to bottom, the report said. Media companies also have a financial incentive to promote representative parity. A Nielsen report revealed last month that Latino viewers spent more time binging shows that included Latino representation behind and in front of the camera. When Latinos do obtain jobs in the media industry, they’re often segregated into service roles. 19% of Latinos who work in media are service workers compared to the 3% in senior management roles, the report said. Latinas have even starker disparities in industry representation. The only roles they have more representation than men are as news analysts/journalists and writers/authors, beating out men by only 1% in both sectors, according to the report. A small group of industry group researchers and representatives, union members, and Hispanic non-profit organization members identified in the report several different challenges that Latinos have obtaining jobs in the industry – like financial and educational barriers – but most of these stakeholders said that limited access to professional networks, in particular, had damaging effects. Some blame could also lie in how the federal government enforces anti-discrimination and equal employment opportunity rules, researchers say. The report provides recommendations that certain federal agencies could take to mitigate this disparity, such as the Equal Employment Opportunity Commission (EEOC) sharing discrimination filing reports with the Federal Communications Commission (FCC), which can perform audits and drop penalties on companies previously flagged by the former agency."
2022-10-05,CNN,Crimean beauty queen fined by Russian authorities for singing patriotic Ukrainian song,Olga Voitovych,https://www.cnn.com/2022/10/05/europe/miss-crimea-fined-ukrainian-song-intl/index.html," A Crimean beauty queen has been fined 40,000 Russian rubles (around $680) by occupying Russian authorities for singing the patriotic Ukrainian song “Chervona Kalyna,” according to Russian state media and pro-Russian regional authorities. Olga Valeeva, who was named Mrs Queen Beauty – Crimea 2022, was spared a jail sentence because she has children who are underage, Russian state news agency TASS reported on Monday. A spokesperson for the Ministry of Internal Affairs in Crimea said in a video that it identified a video online in which “two girls sang a song that is the battle anthem of an extremist organization.” It said that the pair were detained on suspicion of “committing illegal actions aimed at discrediting the use of the Armed Forces of the Russian Federation, as well as publicly displaying prohibited symbols.” They were subsequently found guilty by a court, the ministry said, and Valeeva’s friend was sentenced to 10 days detention. “Chervona Kalyna” is a patriotic Ukrainian song that has gone viral during Russia’s invasion, and rock band Pink Floyd has released a cover version. The lyrics urge the Ukrainian nation to rise up and “rejoice” like a red kalyna shrub (“chervona kalyna”) that is growing in a field. “In Crimea, no one is punished for normal Ukrainian songs,” said Oleg Kriuchkov, adviser to the Russian administration head of occupied Crimea, on Telegram Sunday. “But! No one will allow nationalist hymns to be sung here! If you want to sing ‘Chervona Kalyna’ or ‘Our father is Bandera…’ we will provide a platform – we will take you to neutral territory to Nikolaev or Zaporozhzhia. Sing all you want,” Kriuchkov added. The Ukrainian region of Crimea was illegally annexed by Russia in 2014. Since annexation, human rights observers have described Crimea’s descent into a police state, with local authorities and Russian security services persecuting and arresting those perceived to be loyal to Ukraine, including members of the Crimean Tatar community. A 2020 US State Department report described a pattern of “unlawful or arbitrary killings, including extrajudicial killings by Russia or Russia-led “authorities”; forced disappearances by Russia or Russia-led “authorities”; torture and cruel, inhuman, or degrading treatment or punishment” in Crimea."
2022-10-05,CNN,Kourtney Kardashian says she’s not as close to Khloé as she once was,Marianne Garvey,https://www.cnn.com/2022/10/05/entertainment/kourtney-kardashian-khlo-kardashian/index.html," For anyone who watches “The Kardashians,” sisters Kourtney Kardashian and Khloé Kardashian have always been tight. But now, Kourtney says, the two are in different places. “I think just life isn’t the same. I think I’m in a different place,” she said on the “Not Skinny But Not Fat” podcast. Kourtney Kardashian said Khloé and sister Kim Kardashian are now closer, because they have bonded over welcoming babies around the same time. “I just felt like they really bonded. They were going through the same things,” Kourtney said, adding that for a time she felt the two were ganging up on her. “That’s when I was unhappy with the show, partially ‘cause of (Khloé and Kim) kind of ganging up (on me). I felt like it was almost everything that Khloé and I had done to Kim, and then they were like kind of flipping it on me,” she said. The newlywed said they all love each other, though, and she’s still always in touch with her sisters. “I feel like Khloé and I are good. I spoke to her the whole time she was in Milan; we were FaceTiming. We FaceTimed on the way to school this morning, I saw her this morning at school. You know, we’re good,” she said. “I think just life isn’t the same. I think I’m in a different place.”"
2022-10-05,CNN,The perpetually youthful Adam Sandler talks getting older,Chloe Melas,https://www.cnn.com/2022/10/05/entertainment/adam-sandler-interview/index.html," After three decades entertaining audiences, Adam Sandler somehow still seems ageless. But, now, age 56, the actor and comedian says he’s begun to reflect on his life and career. “I like my age, and it’s fun to play my age,” Sandler says in the latest issue of AARP. “It’s freeing. I don’t have to be true to anything other than what I look like and what I think and what I do in life. I’m nonstop commitment to my projects, though I don’t have the same discipline to keep my body in shape. There hasn’t been one movie where I’ve stayed the same weight throughout a three-month shoot. I used to worry about it. Now I’m okay.” Sandler became a household name on “Saturday Night Live” in the ’90s and has gone on to star in countless comedy classics from “The Wedding Singer” to “50 First Dates.” He says that when looking back on his career, especially his time on “SNL” from 1990 to 1995, he’s more self aware and has new appreciation for his colleagues. “I’m calmer than I used to be. I used to go nuts,” Sandler tells the publication. “I had a quick temper, quick reactions. I made a lot of dumb mistakes and said a lot of stupid things. Looking back on relationships, I could be an a**. I was selfish. I was competitive with other comedians and stuff. My father would say, ‘That guy’s funny,’ and I would say, ‘Hey, I’m funny, blah, blah,’ and he’d be, like, ‘Why can’t you both be funny?’ Because I was hungry, I didn’t always see clearly then.” Adding, “I’m also better at appreciation. I appreciate other people’s talent now rather than competing with it—in every field, in every sport, every part of showbiz. A lot of young comedians, a lot of the new cast on ‘SNL,’ they just make me laugh now.” Sandler and his Happy Madison Productions have achieved remarkable success over the years. Now he says he just wants to enjoy the ride. “I want people to continue to enjoy what I’m doing,” he says. “I hope they’ve had a good time with my movies, with what we’ve given them and, whether you’ve liked me or not, appreciate that I’ve tried my best … I’m just amazed people have trusted me as long as they have in this business and given me shot after shot. Because it would suck to do something else.”"
2022-10-05,CNN,Stocks slip modestly Wednesday following huge two-day surge,Paul R. La Monica,https://www.cnn.com/2022/10/05/investing/dow-stock-market-today/index.html," Maybe that October market rally has some legs after all? Stocks pulled back ever so slightly Wednesday as a fresh batch of economic data revealed continued strength in the job market and America’s services sector. That’s led to new worries that the Federal Reserve’s aggressive rate hikes, meant to curb inflation, will eventually lead to a recession. The Dow was down only about 30 points, essentially flat, in midday trading Wednesday. The Dow had been down more than 400 points earlier and briefly slipped back below 30,000. That put a small dent into this week’s earlier gains. The Dow surged nearly 1,600 points over the course of Monday and Tuesday. The S&P 500 and Nasdaq, which also soared during the past two days, fell 0.3% and 0.5% respectively. Stocks popped earlier this week despite concerns about the financial health of global banking giant Credit Suisse                            (CS) and a drop in job openings in the United States. This bad news lifted Wall Street’s mood because investors bet that it could lead the Fed to slow its pace of rate hikes. Australia’s central bank raised rates by a smaller-than-expected amount as well this week, adding to hopes that global policymakers are starting to worry more about an economic slowdown than inflation. But that narrative shifted a bit Wednesday. Payroll processor ADP reported a bigger-than-expected increase in private sector jobs for September, a sign that American companies are still hiring at a solid pace. What’s more, the Institute for Supply Management reported Wednesday that its non-manufacturing index was higher than forecast. Activity did slow from August, but services companies still reported steady growth. The solid economic data is likely to keep the Fed on course to raise rates sharply in November and December … perhaps too sharply. There are growing concerns that the chances of a so-called monetary policy mistake are increasing and that the Fed will cause a recession. Rising energy prices could weigh on consumer sentiment — and the stock market — as well. OPEC announced production cuts Wednesday, news that lifted oil prices."
