Date,Publisher,Title,Authors,URL,Content
2022-10-05,CNN,Inside the White House’s failed effort to dissuade OPEC from cutting oil production to avoid a ‘total disaster’,"Alex Marquardt, Natasha Bertrand, Phil Mattingly",https://www.cnn.com/2022/10/04/politics/white-house-lobby-opec-oil-production-cuts-gasoline-prices-midterms/index.html," The Biden administration launched a full-scale pressure campaign in a last-ditch effort to dissuade Middle Eastern allies from dramatically cutting oil production, according to multiple sources familiar with the matter. But that effort appears to have failed, following Wednesday’s crucial meeting of OPEC+, the international cartel of oil producers that, as expected, announced a significant cut to output in an effort to raise oil prices. That in turn will likely cause US gasoline prices to rise at a precarious time for the Biden administration, just five weeks before the midterm elections. On Wednesday morning, OPEC+ oil ministers meeting in Vienna agreed to an even larger production cut than the White House had feared — 2 million barrels per day, beginning in November, according to a readout of the meeting released on Wednesday. The ministers said the cuts were necessary “in light of the uncertainty that surrounds the global economic and oil market outlooks.” President Joe Biden told CNN’s Arlette Saenz on Wednesday that he was “concerned” about the cuts, which he viewed as “unnecessary.” Secretary of State Antony Blinken told reporters when asked about the move that “when it comes to OPEC, we’ve made clear our views to the OPEC members.” For the past several days, Biden’s senior-most energy, economic and foreign policy officials were enlisted to lobby their foreign counterparts in Middle Eastern allied countries including Kuwait, Saudi Arabia, and the United Arab Emirates to vote against cutting oil production. Wednesday’s production cut amounts to the largest cut since the beginning of the pandemic and could lead to a dramatic spike in oil prices. Some of the draft talking points circulated by the White House to the Treasury Department on Monday that were obtained by CNN framed the prospect of a production cut as a “total disaster” and warned that it could be taken as a “hostile act.” “It’s important everyone is aware of just how high the stakes are,” said a US official of what was framed as a broad administration effort that is expected to continue in the lead up to the Wednesday OPEC+ meeting. The White House is “having a spasm and panicking,” another US official said, describing this latest administration effort as “taking the gloves off.” According to a White House official, the talking points were being drafted and exchanged by staffers and not approved by White House leadership or used with foreign partners. In a statement to CNN, National Security Council spokesperson Adrienne Watson said, “We’ve been clear that energy supply should meet demand to support economic growth and lower prices for consumers around the world and we will continue to talk with our partners about that.” For Biden, a dramatic cut in oil production could not come at a worse time. The administration has for months engaged in an intensive domestic and foreign policy effort to mitigate soaring energy prices in the wake of Russia’s invasion of Ukraine. That work appeared to pay off, with US gasoline prices falling for almost 100 days in a row. But with just a month to go before the critical midterm elections, US gasoline prices have begun to creep up again, posing a political risk the White House is desperately trying to avoid.  As US officials have moved to gauge potential domestic options to head off gradual increases over the last several weeks, the news of major OPEC+ action presents a particularly acute challenge. Watson, the NSC spokesperson declined to comment on the midterms, saying instead, “Thanks to the President’s efforts, energy prices have declined sharply from their highs and American consumers are paying far less at the pump.” Amos Hochstein, Biden’s top energy envoy, played a leading role in the lobbying effort, which has been far more extensive than previously reported amid extreme concern in the White House over the potential cut. Hochstein, along with top national security official Brett McGurk and the administration’s special envoy to Yemen Tim Lenderking, traveled to Jeddah late last month to discuss a range of energy and security issues as a follow up to Biden’s high-profile visit to Saudi Arabia in July. Officials across the administration’s economic and foreign policy teams were also been involved with reaching out to OPEC governments as part of the latest effort to stave off a production cut. The White House asked Treasury Secretary Janet Yellen to make the case personally to some Gulf state finance ministers, including from Kuwait and the UAE, and try to convince them that a production cut would be extremely damaging to the global economy. The US has argued that in the long-run a cut in oil production would create more downward pressure on prices – the opposite of what a significant cut would be designed to accomplish. Their logic is that “cutting right now would increase risks of inflation,” lead to higher interest rates and ultimately a greater risk of recession. “There is great political risk to your reputation and relations with the United States and the west if you move forward,” the White House draft talking points suggested Yellen communicate to her foreign counterparts. A senior US official acknowledged that the administration lobbied the Saudi-led coalition for weeks to try to convince them not to cut oil production. Wednesday’s production cut comes less than three months after President Joe Biden traveled to Saudi Arabia and met with Crown Prince Mohammed bin Salman on a trip that was driven in part by a desire to convince Saudi Arabia, the de facto leader of OPEC, to increase oil production which would help bring down the then-skyrocketing gasoline prices. When OPEC+ agreed a few weeks later to a modest 100,000 barrel increase in production, critics argued Biden had gotten little in return. The trip was billed as a meeting with regional leaders about issues critical to US national security, including Iran, Israel and Yemen. It was criticized for its lack of results and for rehabbing the image of the crown prince who had been directly blamed by Biden for orchestrating the killing of Washington Post columnist Jamal Khashoggi. In the months leading up to the meeting, Biden’s top aides for the Middle East and energy, McGurk and Hochstein, shuttled between Washington and Saudi Arabia planning and coordinating the visit. One diplomatic official in the region described the US campaign to block production cuts as less of a hard sell, and more of an effort to underscore a critical international moment given the economic fragility and ongoing war in Ukraine. Though another source familiar with the discussions told CNN it was described by a diplomat from one of the countries approached as “desperate.” A source familiar with the outreach says a call was planned with the UAE but the effort was rebuffed by Kuwait. Kuwait’s embassy in Washington did not immediately respond to a request for comment. Neither did Saudi Arabia’s. The UAE embassy declined to comment. Publicly, the White House has cautiously avoided weighing in on the possibility of a dramatic oil production cut. “We are not members of OPEC+, and so I don’t want to get ahead of what could potentially come out of that meeting,” White House press secretary Karine Jean-Pierre told reporters Monday. The US focus, Jean-Pierre said, remains “taking every step to ensure markets are sufficiently supplied to meet demand for a growing global economy.” OPEC+ members are weighing a more dramatic cut due to what has been a precipitous decline in prices, which have dropped sharply to below $90 per barrel in recent months. Hanging over Wednesday’s OPEC+ meeting in Vienna will also be the looming oil price cap that European nations intend to impose on Russian oil exports as punishment for Russia’s invasion of Ukraine. Many OPEC+ members, not only Russia, have expressed unhappiness with the prospect of a price cap because of the precedent it could set for consumers, rather than the market, to dictate the price of oil. Included in the White House talking points to Treasury was a US proposal that if OPEC+ decides against a cut this week the US will announce a buyback of up to 200 million barrels to refill its Strategic Petroleum Reserve (SPR), an emergency stockpile of petroleum that the US has been tapping into this year to help lower oil prices. The administration has made it clear to OPEC+ for months, the senior US official said, that the US is willing to buy OPEC’s oil to replenish the SPR. The idea has been to convey to OPEC+ that the US “won’t leave them hanging dry” if they invest money in production, the official said, and therefore, that prices won’t collapse if global demand decreases."
2022-10-05,CNN,How a 12-foot skeleton became the hottest Halloween decoration around,AJ Willingham,https://www.cnn.com/2022/10/05/us/skeleton-home-depot-skelly-halloween-decoration-trend-cec/index.html," There are two kinds of people: those who understand the allure of a 12-foot skeleton decoration, and those who have yet to understand the allure of a 12-foot skeleton decoration. Fall beckons the arrival of the Home Depot skeleton, a massive Halloween yard decoration that first hit the market in 2020 and has captivated imaginations ever since. Affectionately known as Skelly, the looming figure is now a mascot of sorts for those who delight in the gothic excesses of Halloween decor. Why so many people identify with this creature – enough to snatch up entire inventories in hours and spawn a whole skeleton black market in the process – is a question best left to a higher power. Perhaps Skelly is a bridge between the extremes of our human nature; sorrow and joy, famine and excess, the sacred and the profane encased together in high-density polyethylene. Or perhaps big skeletons are just funny to think about. “I mean, it’s the moment,” says Jenni Tabler, a sociology professor at the University of Wyoming. She summed up the zeitgeist in a now-viral tweet: “Happy enormous skeleton season to all who celebrate.” Tabler doesn’t have a Skelly herself, but she gets the hype. “I think for me as a sociologist, I find it very heartening that we can all rally over some of the small joys in life. And the enormous skeleton is one of those fascinating small joys.” Jill Troutman of Memphis, Tennessee, searched for two years before securing her Skelly. She had an inside contact at her local Home Depot, so when she got a call in September that the skeletons – the skeletons –  were back in stock, she raced to the store and swiftly snapped one up. Well, as swiftly as one can when the skeleton in question comes in a box the size of a Manhattan apartment. “The box was HUGE,” Troutman said. “I wasn’t sure I could get it in my small SUV, but I was going to die trying!” Several retailers like Costco and Lowes now offer their own Halloween behemoths, but the Skelly phenomenon started in the Home Depot offices in 2020. To hear Lance Allen, Home Depot’s senior merchant of holiday décor describe it, bringing Skelly to life was a labor of love. “What our holiday decoration team does is go out into the market, find inspiration, and see what we can do differently.” he tells CNN. ” We went to haunted houses to see what they were doing. We watched all the classic scary movies.” Ultimately, the team spotted a giant torso at a trade show, and the gears started turning. “We really brought the item to market at the perfect time,” he said. “It was during the first year of the pandemic, when everybody just needed to smile.” While the skeleton doesn’t have a name on the box, Allen says people around the office started calling him Skelly and, well, it fit. Allen’s teams know all about the culture their enormous brainchild has spawned, from the store sellouts to the undefinable charisma people find in his LED-illuminated eyes. In response to the Skelly success, Home Depot has added even more immense offerings: A giant pumpkin skeleton rolled out in 2021, as well as a 12-foot-tall levitating witch that was inspired by a floating street performer Allen saw near the Bellagio Hotel in Las Vegas. This year, the retailer debuted a giant werewolf figure that, at 9-and-a-half feet tall, looks like it belongs on the 18th hole of the best putt-putt golf course in town. “What this is showing us is, customers are passionate about items that are larger than life,” he says. Skelly’s popularity presents a chicken-and-egg-type quandary: Does a 12-foot skeleton increase one’s fondness for Halloween decor, or does a fondness for Halloween decor increase one’s likelihood of owning a 12-foot-skeleton? It’s a little of both. Troutman, for instance, is giving her new skeleton (his name is Todd) a place of honor among her existing Halloween finery. “The whole neighborhood enjoys coming by and checking out our decorations,” she says. “I have to rethink the whole scheme because Todd is now the star of the show complete with his own special lighting.” When Vicky Euell and Glenn Grimstad of Toms River, New Jersey, got married last October, their household Skelly served as a wedding altar. “This is our favorite holiday, and everyone knows we don’t have a simple party. It has to be to the nines,” Euell told CNN. The couple’s holiday displays draw admirers from around the area, and last year they acquired the 12-foot Home Depot witch to add to their collection. (Euell, a woman of taste, also has a permanent witch-themed bathroom.) As Halloween passes, Euell and Grimstad have to contend with another critical phase of the Skelly experience: finding a place to store a 12-foot skeleton. “We actually decorate him through the fall, and leave him up through Christmas. Someone even made him a snow suit with a Santa hat.” “But it’s just for indoors,” Euell says.  “I don’t think he’d last outside in that.”"
2022-10-05,CNN,"90% of US adults say the United States is experiencing a mental health crisis, CNN/KFF poll finds",Deidre McPhillips,https://www.cnn.com/2022/10/05/health/cnn-kff-mental-health-poll-wellness/index.html," An overwhelming majority of people in the United States think the country is experiencing a mental health crisis, according to a new survey from CNN in partnership with the Kaiser Family Foundation. Nine out of 10 adults said ​they believed that there’s a mental health crisis in the US today. Asked to rate the severity of six specific mental health concerns, Americans put the opioid epidemic near the top, with more than two-thirds of people identifying it as a crisis rather than merely a problem. More than half identified mental health issues among children and teenagers as a crisis, as well as severe mental illness in adults. The survey captured the perceptions of a nationally representative sample of about 2,000 adults over the summer – 2½ years into the Covid-19 pandemic and amid ongoing public health threats including racism and gun violence. The broad concern is well-founded, rooted in both personal experience and national trends. “The Covid-19 pandemic exacerbated numerous social stressors that we know can increase the risk of both substance use and mental illness,” said Dr. Nora Volkow, director of the National Institute on Drug Abuse. Data from the US Centers for Disease Control and Prevention shows that drug overdose deaths reached record levels in 2021 and suicide rates were back near a record high after two years of decline. And in 2020, mental health-related visits to emergency rooms jumped 31% among adolescents ages 12 to 17. According to the CNN and KFF poll, about half of adults say they have had a severe mental health crisis in their family, including in-person treatment for family members who were a threat to themselves or others, or family members who engaged in self-harming behaviors. More than 1 in 5 adults describe their own mental health as only “fair” or “poor,” including extra-large shares of adults under the age of 30, adults who identify as LGBT and those with an annual income of less than $40,000. A third of all adults said they felt anxious always or often over the course of the past year, including more than half of LGBT adults and those under 30. About 1 in 5 adults said they were often or always depressed or lonely over the past year, too. Major sources of stress for a third or more of adults include personal finances and current and political events. About 1 in 4 adults also identified personal relationships and work, respectively, as major sources of stress. According to the new survey, about 1 in 5 adults received mental health services in the past year. Earlier data published by the CDC supports that finding and shows that mental health treatment became more common over the course of the pandemic: Nearly 22% of adults got mental health treatment in 2021, up from about 19% in 2019. “Perhaps one of the only benefits of the pandemic and the shift that our country has been going through is the increase in our willingness to acknowledge and talk about when we might be struggling or in need of support,” said Sarah Brummett, director of the National Action Alliance for Suicide Prevention’s executive committee. “People are more willing to roll up their sleeves and talk about it and support folks. And I think that’s progress.” Despite increased willingness and commonly shared stressors among the public, most adults who have only fair or poor mental health said they don’t feel comfortable talking to loved ones about it – some to maintain privacy and some to avoid the shame and stigma attached to mental health issues. But the vast majority – more than 4 out of 5 – of those surveyed say individuals and families should play a major role in addressing mental health problems in the US, equal to the share who say the same of health care providers. Experts say there is an opportunity to broaden perceptions about how mental health is part of overall physical health and  how to respond to mental health crises. “Not everyone’s a cardiologist, but a lot of people are trained in CPR,” said Justin Baker, a psychologist and assistant professor at the Ohio State University College of Medicine. “If we only rely on the mental health force, we’re going to keep going around in circles and never actually get anywhere. I think we see this as all of our problems.” Nonetheless, the groups most likely to say they need mental health care in the US are also less likely to say they can get it. Nearly 6 out of 10 adults who say their mental health is only fair or poor say they have not been able to get needed care, as well as about half of adults younger than 30 and LGBT adults. For those who have gone without help, the most common reasons cited were being too busy or unable to take time off work, being unable to afford the cost, and being afraid or embarrassed to seek care, according to the CNN and KFF survey. In his first State of the Union address, President Joe Biden outlined a multipronged strategy to address the country’s mental health crisis, including goals to integrate mental health into primary care, investing in the work force and new approaches to programs that provide care. “Let’s get all Americans the mental health services they need, more people they can turn to for help and full parity between physical and mental health care,” he said in his address in March. According to the poll, most Americans see those issues as significant problems. A majority, 55%, say it’s a big problem that there aren’t enough mental health care providers, about three-quarters say that insurers not covering mental health the way they do physical health is a significant concern, and 80% say the same about the cost of mental health care. Through the American Rescue Plan, the Biden administration has invested $5 billion in mental health and substance use programs through the US Department of Health and Human Services, with billions more proposed in future budgets. One significant shift came this summer, with the transition of the National Suicide Prevention Lifeline to a three-digit dialing code: 988. Early data suggests success, with calls jumping 45% in the first month compared with the same time a year before. But according to the new survey, there is still work to be done. The vast majority of adults (85%) say they would be at least somewhat likely to call the hotline if they or a loved one were experiencing a mental health crisis – and it’s a good alternative to 911, which about a quarter of adults, especially Black and LGBT adults, say would do more harm than good in a mental health crisis situation. It also has potential to help Hispanic people and those who are uninsured, who are more likely than average to say they don’t know who to call if there is a mental health crisis and would not know where to find services. Yet more than half of adults in the new poll say they have heard “nothing at all” about the new 988 hotline. “This can be a preventable public health issue, and we all have a role to play,” Brummett said. The fieldwork for the CNN/KFF Mental Health Survey was conducted by SSRS on July 28 through August 9 among a random national sample of 2,004 adults. The poll includes 1,603 adults who were surveyed online after being recruited using probability-based methods and 401 adults who were selected by random digit dialing and reached on landlines or cellphones by a live interviewer. Results for the full sample have a margin of sampling error of plus or minus 3 percentage points."
2022-10-05,CNN,Chris Martin’s lung infection forces Coldplay to postpone shows,Lisa Respers France,https://www.cnn.com/2022/10/05/entertainment/coldplay-chris-martin-lung-infection/index.html," A serious illness has caused Coldplay to pause their tour. The band announced on their verified Instagram account Tuesday that they would be postponing planned concerts in Brazil after frontman Chris Martin fell ill. “With deep regret, we’ve been forced to postpone our upcoming shows in Rio de Janeiro and São Paulo until early 2023,” the statement read. “Due to a serious lung infection, Chris has been put under strict doctor’s orders to rest for the next three weeks.” According to the statement, the group is “working as fast as possible to lock in the new dates and will follow up with more information in the next few days.” “To everyone in Brazil who was looking forward to these concerts, we’re extremely sorry for any disappointment and inconvenience, and we’re so grateful for your understanding at this challenging time where we need to prioritise Chris’ health,” the statement read. Original tickets will be honored at the rescheduled shows."
