Date,Publisher,Title,Authors,URL,Content
2022-10-05,CNN,"SpaceX, NASA launch 3 astronauts and 1 cosmonaut to the ISS. Here’s everything you need to know",Jackie Wattles,https://www.cnn.com/2022/10/05/world/spacex-nasa-crew-5-astronaut-launch-scn/index.html," SpaceX and NASA launched a crew of astronauts who hail from all over the world on a trip to the International Space Station Wednesday. The mission, which includes some historic firsts, moved forward even as rising geopolitical tensions brew on the ground. The four crew members — astronauts Nicole Mann and Josh Cassada of NASA, astronaut Koichi Wakata of JAXA, or Japan Aerospace Exploration Agency, and cosmonaut Anna Kikina of Roscosmos — took off aboard a SpaceX Crew Dragon spacecraft at 12 p.m. ET from Kennedy Space Center in Florida. After reaching orbit, NASA shared footage of the crew aboard their capsule, sharing their excitement as they explained that they brought along a “freefall indicator” — a small, stuffed doll in the likeness of Albert Einstein. The toy was left to float around the cabin, signaling that the crew had entered weightlessness. Einstein, who first conceptualized the Theory of Relativity, had the “happiest thought of his entire life” when he realized that a “person in freefall can feel their own weight,” Cassada explained in a dispatch from the Crew Dragon spacecraft. “We live in the same world, we live in the same universe. Sometimes we experience it in a very different way from our neighbors. We can all keep that in mind … and continue to do amazing things,” Cassada said, and Kikina could be seen pumping her fist as he spoke. “And do it together.” Dubbed Crew-5, the mission is the sixth astronaut flight launched as a joint endeavor between NASA and SpaceX, a privately held aerospace company, to the space station. The spaceflight marks a historic moment, as Mann not only became the first Native American woman ever to travel to space. She’s also serving as mission commander, making her the first woman ever to take on such a role for a SpaceX mission. What’s more, Kikina is the first Russian to join a SpaceX mission as part of a ride-sharing deal NASA and Russia’s space agency, Roscosmos, inked in July. Her participation in the flight is the latest clear signal that, despite mounting tensions over Russia’s invasion of Ukraine, the decades-long US-Russia partnership in space will persist — at least for now. The Crew Dragon spacecraft is now on a slow, precise trek to the ISS, which orbits about 200 miles (322 kilometers) above the Earth’s surface. The spacecraft is aiming to dock with the space station on Thursday around 5 p.m. ET. Launching NASA astronauts to the space station aboard a SpaceX Crew Dragon spacecraft is nothing new. The space agency collaborated with SpaceX for years to transition the task of shuttling people to and from the space station after NASA retired its Space Shuttle Program in 2011. With the return of astronaut launches from US soil, SpaceX has offered a stage for several historic firsts. The Crew-4 Dragon mission, for example, carried NASA astronaut Jessica Watkins, the first Black woman ever to join the ISS crew. On this flight, Mann, a registered member of the Wailacki tribe of the Round Valley Reservation, became the first Native American woman ever to travel to orbit. “I am very proud to represent Native Americans and my heritage,” Mann told reporters before launch. “I think it’s important to celebrate our diversity and also realize how important it is when we collaborate and unite, the incredible accomplishments that we can have.” In her role as commander, Mann will be responsible for ensuring the spacecraft is on track from the time it launches until it docks with the ISS and again when it returns home with the four Crew-5 astronauts next year. Never before has a woman taken on the commander role on a SpaceX mission, though a couple of women served in that position during the Space Shuttle Program. Kikina, the Roscosmos cosmonaut, became the first Russian ever to launch on a SpaceX vehicle at a time when US-Russian relations are hitting near fever pitch over the Ukraine war. Officials at NASA have said repeatedly that joint operations with Russia on the ISS, where the two countries are the primary operators, will remain isolated from the fray. Kikina’s flight comes just weeks after NASA’s Dr. Frank Rubio launched to the ISS aboard a Roscosmos Soyuz capsule. “I really love my crewmates,” Kikina told reporters after she arrived at the Florida launch site on Saturday. “I really feel good, comfortable. … We will do our job the best way: happy.” During a post-launch news conference, Sergei Krikalev, the executive director of Human Space Flight Programs at Roscosmos, commented on the significance of the US-Russian partnership. “We just continue what was started many years ago, in 1975 when the Apollo-Soyuz crew worked together,” Krikalev said, referring to an in-space meet up in 1975 that became a symbol of post-Cold War cooperation between the United States and Russia. “Now we continue that.” READ MORE: Meet the space trailblazers of color who empowered others to dream Mann and her fellow NASA astronaut Josh Cassada, who grew up in White Bear Lake, Minnesota, both joined NASA in 2013. Cassada has described Mann as one of his “closest friends on the planet.” As with Mann, this mission is the first trip to space for Cassada and Kikina. For veteran astronaut Wakata, who has previously flown on both NASA’s space shuttle and Russia’s Soyuz spacecraft, this trip marks his fifth spaceflight mission. “I still remember when I first flew and saw our beautiful home planet,” he recalled during an August press conference. “It was so wonderful, such a beautiful planet, then I felt very lucky to be able to call this planet our home.” After reaching the ISS, the crew will join the seven astronauts already aboard the ISS — including four NASA astronauts, a European Space Agency astronaut and two Russian cosmonauts. There will be a handover period, where the current ISS crew will help the newly arrived astronauts settle in before a separate Crew Dragon spacecraft brings the four astronauts who were part of SpaceX’s Crew-4 mission back home. Then the Crew-5 astronauts will set to work conducting spacewalks, during which astronauts exit the ISS, to maintain the space station’s exterior, as well as performing more than 200 science experiments. “Experiments will include studies on printing human organs in space, understanding fuel systems operating on the Moon, and better understanding heart disease,” according to NASA. Crew-5 is slated to return from space in about five months."
2022-10-05,CNN,Soccer lexicon: ‘Squeaky bum time’ and ‘park the bus’ added to Oxford English Dictionary,Alasdair Howorth,https://www.cnn.com/2022/10/05/football/alex-ferguson-jose-mourinho-english-dictionary-spt-intl/index.html," Soccer’s lexicon is a rich reservoir of often curiously contorted cliche and phrasing, frequently the subject of parody. Now, the linguistic ingenuity of two of the most influential coaches in modern football – Alex Ferguson and Jose Mourinho – have been officially recognized by the Oxford English Dictionary (OED). Ferguson’s phrase “squeaky bum time” and Mourinho’s “park the bus” comment were two of 15 football-themed OED additions ahead of the World Cup in Qatar later this year. “While the OED already covered a large number of football terms, from catenaccio to nutmeg to water carrier, this select batch of additions fills a few gaps in our formation,” the dictionary said in a statement. The term “squeaky bum time” originated in a 2003 media conference when Ferguson was looking to heap pressure on Manchester United’s English Premier League rival Arsenal. “They have a replay against Chelsea and if they win it they would face a semifinal three days before playing us in the league,” said Ferguson. “But then they did say they were going to win the treble, didn’t they? It’s squeaky bum time and we’ve got the experience now to cope.” The OED defines Ferguson’s phrase as a “a reference to the sound of someone shifting restlessly on plastic seating during tense closing stages of a contest.” Current AS Roma coach Mourinho, who is famed for his influence on British culture – including a cameo appearance in English rapper and singer Stormzy’s latest music video – has also made the OED cut. The OED’s definition of the former Chelsea manager’s “park the bus” is “to play in a very defensive way, typically by having the majority of outfield players close to their own goal and showing little attacking intent.” “As we say in Portugal, they brought the bus and they left the bus in front of the goal,” Mourinho said after Chelsea’s 0-0 draw against Tottenham in 2004. “I would have been frustrated if I had been a supporter who paid £50 [around $56] to watch this game because Spurs came to defend. I’m really frustrated because there was only one team looking to win, they only came not to concede. It’s not fair for the football we played.” Some of the other football-related OED entries are: “Total Football” (a brand of attacking, possession-based football often credited to the Netherlands), “Row Z” (the furthest seat from the sideline in a stadium), “False No. 9” (a player who starts in the striker position but drops deeper in the field) and “Trequartista” (an Italian expression describing a player who plays in the spaces between the midfield and strikers)."
2022-10-05,CNN,Greenpeace campaigners disrupt Liz Truss’s party conference speech,"Peter Wilkinson, Chris Liakos",https://www.cnn.com/2022/10/05/uk/liz-truss-greenpeace-conservative-conference-gbr-intl/index.html," Protesters from the environmental group Greenpeace were ejected from the Conservative Party conference on Wednesday after disrupting British Prime Minister Liz Truss’s first speech as leader. Two female activists held up a flag that read “Who voted for this?” before they were escorted out of the conference center in Birmingham by security guards as the crowd booed. “Let’s get them removed,” said Truss, to applause. Truss quipped following their removal that the “anti-growth coalition” had arrived at the hall “a bit too early.” Greenpeace confirmed that its activists were responsible for the protest. In a tweet, the group said activists were there to “denounce the Prime Minister ‘shredding’ her party’s 2019 manifesto promises.” “The PM is U-turning on fracking, strong climate action, and world-leading environmental protections. Who voted for this?” The conference was taking place amid open party dissent following a screeching U-turn on Monday over a proposal to cut the top rate of UK income tax – an announcement that sent the pound to historic lows and sparked market chaos. The move was seen as insensitively helping the rich at the same time as Britons are living through the worst cost-of-living crisis for decades. Truss, who became prime minister one month ago to the day after succeeding Boris Johnson, started off her speech by saying the country is in a new era dealing with a global economic crisis and that “in these tough times, we need to step up.” “We gather at a vital time for the UK,” she said adding that “these are stormy days.” “We’re dealing with the global economic crisis caused by Covid and by Putin’s appalling war in Ukraine. In these tough times, we need to step up,” she also said. “I am determined to get Britain moving,” she added and “to put us on a strongest footing as a nation.” Truss criticized the “anti-growth coalition” that included “some of the people we had in the hall earlier.” She added: “Economic growth makes us strong at home and strong abroad and we need an economically sound and secure United Kingdom and that will mean challenging those who try to stop growth.” The prime minister was giving her speech as Conservative members of parliament voiced fears the combination of tax cuts along with huge public spending to help people cope with energy bills, rising inflation, rising interest rates and a falling pound are going to make winning the next general election impossible. “I will not allow the anti-growth coalition to hold us back,” Truss said. “Labour, the Lib Dems, the SNP, the militant unions, the vested interests dressed up as think tanks, the talking heads, the Brexit deniers, Extinction Rebellion and some of the people we had in the hall earlier. “The fact is they prefer protesting to doing. They prefer talking on Twitter to taking tough decisions. “They taxi from north London townhouses to the BBC studio to dismiss anyone challenging the status quo. “From broadcast to podcast, they peddle the same old answers. It’s always more taxes, more regulation and more meddling. Wrong, wrong, wrong.” Truss walked on to the conference stage to the music of 1990s hit, “Moving on Up,” by M People. Later, the group’s founder Mike Pickering tweeted his opposition to the use of the song by the Conservatives. “So apparently we can’t stop Truss walking out to our song, very weird! So sad it got used by this shower of a government,” he wrote."
2022-10-05,CNN,Sanibel Island residents return to see if their homes survived devastating Hurricane Ian,"Nouran Salahieh, Dakin Andone",https://www.cnn.com/2022/10/05/us/hurricane-ian-florida-recovery-wednesday/index.html," Residents of Florida’s Sanibel Island are warned they could be shocked when they return by boat Wednesday to their hard-hit community to set eyes for the first time on the devastation wrought a week ago by Hurricane Ian whose damage zone President Joe Biden is also due to visit today. “It is going to be emotional when they see their properties up close and the amount of damage that this storm inflicted upon them,” City Manager Dana Souza told CNN of how residents and business owners may react on Sanibel Island, where Ian wiped out parts of the causeway, severing its connection to the mainland. The opening of Sanibel to residents comes the same day President Joe Biden is visiting Florida to see Ian’s destruction first-hand. The President, who received an aerial tour of the damage in Fort Myers, is also being briefed by Gov. Ron DeSantis and other Florida officials on the response to the storm and recovery efforts. FOLLOW LIVE UPDATES At least 110 people have been reported killed as a result of the storm – 105 of them in Florida and five in North Carolina. And it’s not clear how many people are still missing as officials work to compile a list of those who remain unaccounted for, Florida Division of Emergency Management Director Kevin Guthrie said Monday. More than 1,000 search and rescue personnel have combed through 79,000 structures across the Sunshine State, Gov. Ron DeSantis told reporters Tuesday, with more than 2,300 rescues logged. Statewide, about 290,000 customers still have no power Wednesday, according to PowerOutage.us, many of them in hard-hit Lee and Charlotte counties. Many schools also remain shuttered, some hospitals are still struggling to provide care, and boil-water notices remain in place in some areas. As Sanibel Island residents access their properties, the area is still “extremely unsafe,” Mayor Holly Smith said. And houses that look fine from the outside may prove to be too damaged to live in. But Dan and Tony Tabor were lucky. The couple returned to their Sanibel home prepared for the worst, with water, bleach and drywall cutters in tow to begin the rebuilding process. Instead, they found it practically untouched by the storm, with the screens on their porch still in place and plants left outside still upright. If they wanted to, they said, they could spend tonight in the home. “We are so happy,” Tony Tabor said, but “I feel so guilty, because our neighbors have seen so much damage to their houses.” Meanwhile, it could be some time before hundreds of residents of Naples, in Collier County, can get back in their homes, City Manager Jay Boodheshwar, told CNN. “There was a significant amount of homes, in fact, an entire neighborhood was submerged at least with 3 feet of water. Some areas got 6 to 7 feet of water,” Boodheshwar said. “I would guess it’s probably hundreds of households that are going to be experiencing a period of time when they’re not going to be able to be in their homes.” Many homes in the once-tranquil community on Sanibel Island “are not livable,” Sanibel Fire Chief William Briscoe has said. “There are places off their foundation, and it’s very dangerous out there,” he said previously. “There are alligators running around, and there are snakes all over the place.” Most of the electrical poles and transmission lines remain down, along with wastewater systems, Souza said. “Without those necessary infrastructure, it is difficult to sustain a community of 7,000 people year around,” Souza added. “It will be some time before we can resume normal life on Sanibel,” he said. The island’s year-round population is about 7,000 people, growing to 35,000 during the high season that typically would begin in about a month, Souza said. But it could take a month or longer just to restore power to some areas of Sanibel and Pine islands, Lee County Electric Cooperative spokesperson Karen Ryan told CNN. “It will be much easier to restore power once we can gain access to the island,” she said. DeSantis directed transportation authorities to prioritize the repair of the Sanibel Causeway. “Access to our barrier islands is a priority for our first responders and emergency services who have been working day and night to bring relief to all Floridians affected by Hurricane Ian,” he said in a statement. Pine Island residents should be able to access their community by car later Wednesday, Gov. DeSantis announced, when crews are expected to complete a temporary fix for a part of a damaged bridge washed away in the storm. At Salty Sam’s Marina in Fort Myers, owner Darrell Hanson and many of his employees – about 120 at this time of year and up to 200 at the height of tourist season – are working to salvage what they can, some of them dealing with the loss of their livelihoods and personal property. “In the parking lot, we must have had about 12 feet of water. Everything on the first floor was … destroyed,” said Hanson, who has so far been unable to access his own home on Sanibel Island. “All our gift stores and restaurants and everything, they’ve lost all their inventory. It’s hundreds of thousands of dollars that each business lost.” “But the employees have all come together,” he said, choking back tears. “They’re all out there working their butt off.” Employee Ty Landers, who works on a pirate cruise at the marina, rode out the storm at his family’s home in Fort Myers. Fortunately the home and his family are safe, he said. But some of his coworkers weren’t so lucky. “Many of our employees, even on the pirate ships, my crewmates, they lost their houses, they lost everything,” Landers told CNN. “Hopefully when the time’s right they’ll come back. But right now their lives fell apart, and they’re putting it back together.” In Charlotte County, north of Fort Myers, public schools will be closed until further notice after several of its 22 schools were damaged by Ian. “The storm lasted here for over 12 hours, just hammering away. Nothing is safe right now,” Charlotte County public schools spokesperson Mike Riley said. Florida hospitals have also been struggling. Emergency departments sustained damage, staffing is impacted as hospital workers were displaced or lost their vehicles, and some facilities lost reliable access to water. “We were ready, we had our generators all ready. We had plenty of fuel. What we couldn’t anticipate and didn’t anticipate was the loss of water from our utility companies,” said Dr. Larry Antonucci, president and CEO of Lee Health. Many areas remain under boil water notices since the storm made landfall, damaging critical infrastructure, as well as homes. Residents of Lee and Charlotte counties – the two counties with the highest death tolls from the hurricane – will be able to get temporary blue coverings with fiber-reinforced sheeting at no cost for their roofs to help reduce further damage, according to a Charlotte County news release. Jessica Hernstadt, a resident of Fort Myers Beach in Lee County, said the community “looked like an apocalyptic disaster” when she made her way there after Ian slammed the shore, with cars, pots, pans and clothing littering the area. Homes the storm tore from their foundations blocked the streets leading to her house, which she found ablaze when she arrived, she told CNN in an interview Wednesday. Later, combing through the ashes, Hernstadt found just one item unscathed: a candlestick holder her great-grandmother carried in her pockets as she emigrated from Poland to the US. “It was the simplest, most prized possession that I had, and it gave me a sense of hope, especially today being Yom Kippur,” she said Wednesday, the holiest day of the year in Judaism. “We will survive. Our town will survive, and there’s hope to rebuild.”"
